program_id,family,authority_root,decision,evidence_level,status,release_ready,same_sample_action,entity_type,parent_family_id,translation_id,parent_translation_ids,programme_exposure_class,multiplicity_family
tsmom_v6,Time-series momentum,phase_kraken_full_tsmom_v6_aggregate_20260707_v1,defer_current_translation,level_3_train_only_materialized_controls_stress_diagnostic_capped,prior_lineage_strategic_continuity_only,False,preserve current decision; no rescue,historical_translation,,tsmom_v6,,program_exposed_historical,
a1_compression,A1 liquid-leader continuation and compression breakouts,phase_kraken_a1_compression_full_180shard_funding_corrected_20260711_v1_20260711_194859,defer_current_translation,train_only_control_context_adjudication_capped_not_validation,prior_lineage_strategic_continuity_only,False,preserve current decision; no rescue,historical_translation,,a1_compression,,program_exposed_historical,
prior_high_reclaim_v2,"Prior-high proximity, breakout and reclaim",phase_kraken_prior_high_reclaim_v2_canonical_train_scan_20260712_v1,defer_current_translation,train_only_materialized_real_controls_capped,prior_lineage_strategic_continuity_only,False,preserve current decision; no rescue,historical_translation,,prior_high_reclaim_v2,,program_exposed_historical,
c2_post_catalyst,Post-catalyst continuation base,phase_kraken_c2_sample_limited_economic_tranche_20260713_v1,current_translation_weak,sample_limited_train_only_capped,prior_lineage_strategic_continuity_only,False,preserve current decision; no rescue,historical_translation,,c2_post_catalyst,,program_exposed_historical,
lfbs_repaired,Liquid failed-breakout short,phase_kraken_lfbs_signal_state_repaired_screen_20260715_v1,current_translation_weak,level_4_event_ledger_plus_real_controls,prior_lineage_strategic_continuity_only,False,preserve current decision; no rescue,historical_translation,,lfbs_repaired,,program_exposed_historical,
backside_blowoff_repaired,Backside-confirmed blowoff short,phase_kraken_backside_blowoff_signal_state_repaired_screen_20260715_v1,current_translation_weak,level_4_event_ledger_plus_real_controls,prior_lineage_strategic_continuity_only,False,preserve current decision; no rescue,historical_translation,,backside_blowoff_repaired,,program_exposed_historical,
rfbs_repaired,Risk-off failed-bounce short,phase_kraken_rfbs_signal_state_repaired_screen_20260715_v1,fragile_context_sleeve,level_4_event_ledger_plus_real_controls,prior_lineage_strategic_continuity_only,False,preserve current decision; no rescue,historical_translation,,rfbs_repaired,,program_exposed_historical,
delayed_flush_reclaim,Delayed flush reclaim long,phase_kraken_delayed_flush_reclaim_signal_state_repair_20260715_v1,current_translation_weak,level_4_event_ledger_plus_real_controls,prior_lineage_strategic_continuity_only,False,preserve current decision; no rescue,historical_translation,,delayed_flush_reclaim,,program_exposed_historical,
breakout_retest_v2,Close-confirmed breakout retest long,phase_kraken_close_confirmed_breakout_retest_long_screen_20260715_v2,current_translation_rejected_only,level_4_event_ledger_plus_real_controls,prior_lineage_strategic_continuity_only,False,preserve current decision; no rescue,historical_translation,,breakout_retest_v2,,program_exposed_historical,
failed_breakdown_reclaim,Failed-breakdown squeeze reclaim long,phase_kraken_failed_breakdown_squeeze_reclaim_long_screen_20260716_v1,mechanism_preserved_current_translation_weak,level_4_event_ledger_plus_real_controls,prior_lineage_strategic_continuity_only,False,preserve current decision; no rescue,historical_translation,,failed_breakdown_reclaim,,program_exposed_historical,
strong_close_handoff,Strong-close session-handoff continuation,phase_kraken_strong_close_session_handoff_continuation_20260716_v1,current_translation_weak,level_4_event_ledger_plus_real_controls,prior_lineage_strategic_continuity_only,False,preserve current decision; no rescue,historical_translation,,strong_close_handoff,,program_exposed_historical,
rs_breakout_btc,Relative-strength breakout versus BTC,phase_kraken_relative_strength_breakout_vs_btc_screen_20260716_v1,mechanism_preserved_current_translation_weak,level_4_event_ledger_plus_real_controls,prior_lineage_strategic_continuity_only,False,preserve current decision; no rescue,historical_translation,,rs_breakout_btc,,program_exposed_historical,
btc_alt_diffusion,BTC-led delayed alt diffusion,phase_kraken_btc_led_delayed_alt_diffusion_long_screen_20260716_v1,fragile_context_sleeve,level_4_event_ledger_plus_real_controls,prior_lineage_strategic_continuity_only,False,preserve current decision; no rescue,historical_translation,,btc_alt_diffusion,,program_exposed_historical,
session_open_range,Asia and U.S. cash-open range resolution,phase_kraken_session_open_range_resolution_20260716_v1,current_translation_rejected_only,level_4_event_ledger_plus_real_controls,prior_lineage_strategic_continuity_only,False,preserve current decision; no rescue,historical_translation,,session_open_range,,program_exposed_historical,
C01,Debetaed residual shock path bifurcation,phase_kraken_c01_level3_economic_20260717_v1_20260717_103227,level3_no_primary_pass_stop,level_3_train_only_kill_screen,first_wave_terminal,False,"No subset rescue, opposite direction, horizon or threshold retune",historical_translation,,C01,,program_exposed_historical,
C02,Positive resolution-aware spot-led continuation,phase_kraken_c02_positive_spot_led_level3_20260717_v1_20260717_161958,level3_no_primary_pass_stop,level_3_train_only_kill_screen,first_wave_terminal,False,"No negative branch, shifted clocks, alternative thresholds/horizons or subset rescue",historical_translation,,C02,,program_exposed_historical,
C03,PIT cohort breadth and dispersion context,phase_kraken_c03_pit_cohort_breadth_20260717_v1_20260717_173151,C03_PIT_authority_unavailable,data_authority_unavailable,first_wave_terminal,False,No current-survivor or bar-existence substitution,historical_translation,,C03,,program_exposed_historical,
C16,ETF/regulated-access flow transmission,phase_c16_flow_authority_20260717_v1,C16_flow_authority_unavailable,data_authority_unavailable,next_wave_authority_terminal,False,No Kraken join or C16 contract without new versioned official daily authority,historical_translation,,C16,,program_exposed_historical,
KDA01,Crowding and price-progress bifurcation,docs/agent/task_archive/20260719_donch_bt_stage_8c1_kda01_forensic_timing_audit_20260719_v1,KDA01_level3_repaired_no_primary_pass_stop,level_3_repaired_train_only_kill_screen,kraken_derivatives_terminal,False,"No costs, opposite direction, basis change, threshold, timing, year, symbol, or horizon rescue",historical_translation,,KDA01,,program_exposed_historical,
KDA02A,Liquidation and OI purge state machine,docs/agent/task_archive/20260719_donch_bt_stage_9_kda02_purge_adjudication_conditional_level3_20260719_v1,KDA02_level3_no_primary_pass_stop,level_3_train_only_kill_screen,kraken_derivatives_unconditional_terminal,False,"No threshold, direction, horizon, year, symbol, robustness, or control rescue",historical_translation,,KDA02A,,program_exposed_historical,
KDA02_NEG_6H,Negative completed-purge reversal six-hour branch,docs/agent/task_archive/20260719_donch_bt_stage_9_kda02_purge_adjudication_conditional_level3_20260719_v1,KDA02_level3_no_primary_pass_stop,post_hoc_context_hypothesis,conditional_context_candidate_unvalidated,False,Same sample limited to explanation and separately authorized controls; independent evidence required,historical_translation,,KDA02_NEG_6H,,program_exposed_historical,
KDA02_ACTIVE,Active purge continuation,docs/agent/task_archive/20260719_donch_bt_stage_9_kda02_purge_adjudication_conditional_level3_20260719_v1,mechanically_unavailable,mechanical_feasibility_only,strict_5m_mechanically_unavailable,False,Do not label economically rejected,historical_translation,,KDA02_ACTIVE,,program_exposed_historical,
KDA02B,OI vacuum without liquidation,docs/agent/task_archive/20260719_donch_bt_stage_9_kda02_purge_adjudication_conditional_level3_20260719_v1,candidate_library_only,outcome_free,inactive_candidate_library,False,No outcomes opened and no inference from KDA02A,historical_translation,,KDA02B,,program_exposed_historical,
KDA02C,Isolated versus systemic purge breadth,docs/agent/task_archive/20260719_donch_bt_stage_9_kda02_purge_adjudication_conditional_level3_20260719_v1,post_hoc_context_hypothesis,no_economic_evidence,post_hoc_hypothesis_presence,False,No same-sample promotion,historical_translation,,KDA02C,,program_exposed_historical,
KDA03,Basis-shock catch-up continuation and rejection,docs/agent/task_archive/20260719_donch_bt_stage_11_kda03_basis_shock_20260719_v2,KDA03_level3_routes_assigned,level_3_train_only_policy_routing,kraken_derivatives_routes_assigned,False,Eleven of twelve primary definitions translation-rejected; negative completed-basis rejection 6h is sample-limited and requires independent evidence; no same-sample rescue,historical_translation,,KDA03,,program_exposed_historical,
KDA03_NEG_REJECTION_6H,Negative completed-basis rejection six-hour branch,docs/agent/task_archive/20260719_donch_bt_stage_11_kda03_basis_shock_20260719_v2,KDA03_level3_routes_assigned,level_3_train_only_sample_limited,sample_limited_prospective_candidate,False,"Not control-eligible; high_variance, wide_cluster_uncertainty, threshold_sensitive; no same-sample rescue or promotion",historical_translation,,KDA03_NEG_REJECTION_6H,,program_exposed_historical,
KDA02B_v2_oi_vacuum_redevelopment,OI vacuum without liquidation — redevelopment,docs/agent/research_campaigns/kraken_research_campaign_001_readiness,phase1_blocked_duration_retention_boundary_and_semantic_limit_acceptance,outcome_free_measurement_only,prospective_translation_not_economically_tested,False,No economic inference; inherits KDA02 attempts and programme exposure,prospective_translation,KDA02,KDA02B_v2_oi_vacuum_redevelopment,KDA02A|KDA02B,program_exposed_historical,KDA02_inherited
KDA02C_v1_purge_breadth_context,Isolated versus systemic purge breadth — redevelopment,docs/agent/research_campaigns/kraken_research_campaign_001_readiness,phase1_blocked_measurement_materialization,outcome_free_registration_only,prospective_post_hoc_translation_not_economically_tested,False,Post-hoc label retained; no same-sample promotion,prospective_translation,KDA02,KDA02C_v1_purge_breadth_context,KDA02A|KDA02C,program_exposed_historical,KDA02_inherited_post_hoc
KDX01_v1_downside_completed_derivatives_state_rejection,Downside completed derivatives-state rejection,docs/agent/research_campaigns/kraken_research_campaign_001_readiness,phase1_blocked_measurement_materialization,outcome_free_registration_only,prospective_contaminated_translation_not_economically_tested,False,Cross-family contamination retained; no independent claim from 2023-2025,prospective_translation,KDA01_KDA02_KDA03_cross_family,KDX01_v1_downside_completed_derivatives_state_rejection,KDA01|KDA02A|KDA03_NEG_REJECTION_6H,program_exposed_historical,KDA_cross_family_inherited
C17_v1_executed_catalyst_state,Executed catalyst state crossed with participation,docs/agent/research_campaigns/kraken_research_campaign_001_readiness,phase1_blocked_timestamp_and_fold_authority,outcome_free_source_seed_only,prospective_separate_campaign_not_economically_tested,False,Keep separate; seed is not a closed census and no response was opened,prospective_translation,C17,C17_v1_executed_catalyst_state,C2|H39|H40|H41|H42,program_exposed_historical,catalyst_lineage_inherited_not_fully_recoverable
